{
  "schemaVersion": 8,
  "dataRevision": 13,
  "lastUpdated": "2026-07-09T00:00:00.000Z",
  "trip": {
    "id": "UK-2027",
    "name": "UK Road Trip 2027",
    "subtitle": "Singapore to Britain and back",
    "startDate": "2027-06-05",
    "endDate": "2027-06-19",
    "homeCurrency": "GBP",
    "budget": 6500,
    "heroImage": "../assets/images/highlands-road.jpg",
    "travelers": [],
    "vehicle": {
      "label": "UK rental car",
      "registration": "TBC",
      "provider": "TBC",
      "pickup": "London Heathrow",
      "dropoff": "London"
    },
    "notes": "The travel dates and route are fixed. Hotels, attractions, restaurants, flight details and reservation references remain provisional until confirmed.",
    "route": [
      "Singapore",
      "London Heathrow",
      "Stonehenge",
      "Bristol",
      "Cotswolds",
      "Windermere",
      "Edinburgh",
      "St Andrews",
      "York",
      "Bicester Village",
      "London",
      "Singapore"
    ]
  },
  "drivingGuide": {
    "units": "Miles and miles per hour",
    "emergencyNumber": "999",
    "breakdownNumber": "TBC",
    "lastReviewed": "2026-07-06",
    "sourceUrl": "https://www.gov.uk/guidance/the-highway-code",
    "rules": [
      {
        "id": "drive-left",
        "title": "Keep left",
        "detail": "Drive on the left and keep to the left-hand lane on multi-lane roads unless overtaking or signs direct otherwise."
      },
      {
        "id": "speed-limits",
        "title": "Read every speed sign",
        "detail": "For cars, national limits are generally 60 mph on single carriageways and 70 mph on dual carriageways and motorways. Always follow posted limits."
      },
      {
        "id": "seat-belts",
        "title": "Seat belts for every occupant",
        "detail": "Use a seat belt whenever one is fitted and ensure each passenger has their own belted seat."
      },
      {
        "id": "phones",
        "title": "No hand-held phone use",
        "detail": "Set navigation before moving and stop safely before making changes."
      },
      {
        "id": "breakdown",
        "title": "Move to relative safety",
        "detail": "For a breakdown, leave the live carriageway when possible, use hazard lights and follow motorway emergency guidance."
      }
    ]
  },
  "tubePlan": {
    "lastReviewed": "2026-07-06",
    "sourceUrl": "https://tfl.gov.uk/plan-a-journey/",
    "paymentNote": "Tube routes are provisional. Recheck fares, closures, disruptions and step-free availability with TfL before each journey.",
    "journeys": [
      {
        "id": "tube-westminster-tower",
        "date": "2027-06-18",
        "time": "10:00",
        "from": "Westminster",
        "to": "Tower Hill",
        "route": "District line eastbound",
        "durationMinutes": 12,
        "status": "idea",
        "accessibility": "Check current step-free status with TfL.",
        "notes": "Provisional sightseeing transfer."
      },
      {
        "id": "tube-paddington-heathrow",
        "date": "2027-06-19",
        "time": "10:00",
        "from": "Paddington",
        "to": "Heathrow Terminals 2 and 3",
        "route": "Elizabeth line direct",
        "durationMinutes": 35,
        "status": "idea",
        "accessibility": "Verify lift availability and airline terminal before departure.",
        "notes": "Provisional airport route if the final London hotel is near Paddington."
      }
    ]
  },
  "budgetCategories": [
    "Accommodation",
    "Flights",
    "Car Rental",
    "Fuel",
    "Parking",
    "Food",
    "Shopping",
    "Activities",
    "Miscellaneous"
  ],
  "noteCategories": [
    "General",
    "Booking",
    "Driving",
    "Food"
  ],
  "notes": [
    {
      "id": "note-fixed-route",
      "title": "Fixed route",
      "body": "Singapore, London Heathrow, Stonehenge, Bristol, Cotswolds, Windermere, Edinburgh, St Andrews, York, Bicester Village, London, Singapore.",
      "category": "General",
      "dayId": "",
      "pinned": true,
      "updatedAt": "2026-07-06T00:00:00.000Z"
    },
    {
      "id": "note-booking-status",
      "title": "Provisional bookings",
      "body": "Do not treat any hotel, attraction or restaurant in this database as confirmed until its status and reference are updated.",
      "category": "Booking",
      "dayId": "",
      "pinned": true,
      "updatedAt": "2026-07-06T00:00:00.000Z"
    },
    {
      "id": "note-long-drives",
      "title": "Long driving days",
      "body": "Protect extra time for the Cotswolds to Windermere, St Andrews to York, and York to London driving days.",
      "category": "Driving",
      "dayId": "",
      "pinned": false,
      "updatedAt": "2026-07-06T00:00:00.000Z"
    }
  ],
  "days": [
    {
      "id": "day-01",
      "date": "2027-06-05",
      "title": "Singapore to London Heathrow",
      "region": "London Heathrow",
      "country": "England",
      "summary": "Travel from Singapore to London Heathrow and settle in before beginning the road trip.",
      "distanceMiles": 5,
      "driveMinutes": 20,
      "overnightPlaceId": "hotel-heathrow",
      "activities": [
        {
          "id": "activity-001",
          "time": "08:00",
          "type": "transport",
          "title": "Travel from Singapore",
          "placeId": "singapore-changi",
          "status": "planned",
          "notes": "Flight number and departure time TBC."
        },
        {
          "id": "activity-002",
          "time": "18:00",
          "type": "transport",
          "title": "Arrive at London Heathrow",
          "placeId": "london-heathrow",
          "status": "planned",
          "notes": "Arrival time and terminal TBC."
        },
        {
          "id": "activity-003",
          "time": "20:00",
          "type": "hotel",
          "title": "Check in near Heathrow",
          "placeId": "hotel-heathrow",
          "status": "idea",
          "notes": "Hotel is provisional."
        }
      ]
    },
    {
      "id": "day-02",
      "date": "2027-06-06",
      "title": "Heathrow to Stonehenge and Bristol",
      "region": "Wiltshire and Bristol",
      "country": "England",
      "summary": "Collect the rental car, visit Stonehenge and continue to Bristol.",
      "distanceMiles": 125,
      "driveMinutes": 200,
      "overnightPlaceId": "hotel-bristol",
      "activities": [
        {
          "id": "activity-004",
          "time": "08:30",
          "type": "drive",
          "title": "Collect rental car at Heathrow",
          "placeId": "london-heathrow",
          "status": "planned",
          "notes": "Rental company and collection details TBC."
        },
        {
          "id": "activity-005",
          "time": "11:30",
          "type": "attraction",
          "title": "Visit Stonehenge",
          "placeId": "stonehenge",
          "status": "idea",
          "notes": "Timed admission is provisional."
        },
        {
          "id": "activity-006",
          "time": "15:30",
          "type": "drive",
          "title": "Drive to Bristol",
          "status": "planned",
          "notes": "Allow time for traffic and a rest stop."
        },
        {
          "id": "activity-007",
          "time": "18:00",
          "type": "hotel",
          "title": "Check in at Bristol",
          "placeId": "hotel-bristol",
          "status": "idea",
          "notes": "Hotel is provisional."
        }
      ]
    },
    {
      "id": "day-03",
      "date": "2027-06-07",
      "title": "Bristol",
      "region": "Bristol",
      "country": "England",
      "summary": "A full day to explore Bristol before continuing north.",
      "distanceMiles": 15,
      "driveMinutes": 45,
      "overnightPlaceId": "hotel-bristol",
      "activities": [
        {
          "id": "activity-008",
          "time": "09:30",
          "type": "attraction",
          "title": "Explore Bristol Harbour",
          "placeId": "bristol-harbour",
          "status": "idea",
          "notes": "Walking route and museum stops are provisional."
        },
        {
          "id": "activity-009",
          "time": "14:30",
          "type": "attraction",
          "title": "Visit Clifton Suspension Bridge",
          "placeId": "clifton-bridge",
          "status": "idea",
          "notes": "Visit depends on weather and parking."
        },
        {
          "id": "activity-010",
          "time": "19:00",
          "type": "restaurant",
          "title": "Dinner in Bristol",
          "placeId": "restaurant-bristol",
          "status": "idea",
          "notes": "Restaurant is provisional."
        }
      ]
    },
    {
      "id": "day-04",
      "date": "2027-06-08",
      "title": "Bristol to the Cotswolds",
      "region": "Cotswolds",
      "country": "England",
      "summary": "Leave Bristol and begin the Cotswolds section of the trip.",
      "distanceMiles": 60,
      "driveMinutes": 105,
      "overnightPlaceId": "hotel-cotswolds",
      "activities": [
        {
          "id": "activity-011",
          "time": "09:30",
          "type": "drive",
          "title": "Drive from Bristol to the Cotswolds",
          "status": "planned",
          "notes": "Final village base and route TBC."
        },
        {
          "id": "activity-012",
          "time": "12:30",
          "type": "restaurant",
          "title": "Lunch in the Cotswolds",
          "placeId": "restaurant-cotswolds",
          "status": "idea",
          "notes": "Restaurant is provisional."
        },
        {
          "id": "activity-013",
          "time": "15:00",
          "type": "walk",
          "title": "First Cotswolds village walk",
          "placeId": "cotswolds-villages",
          "status": "idea",
          "notes": "Village selection is provisional."
        },
        {
          "id": "activity-014",
          "time": "18:00",
          "type": "hotel",
          "title": "Check in at the Cotswolds",
          "placeId": "hotel-cotswolds",